{
  "schema": "liaison/locale-catalog@1",
  "locale": "ja-JP",
  "source_locale": "en-IE",
  "catalog_version": 1,
  "status": "human-review-required",
  "review": {
    "reviewer": null,
    "reviewed_at": null,
    "notes": "Sample navigation terms only. Native product-language review is required before release."
  },
  "messages": {
    "app.name": "Liaison RM",
    "nav.today": "今日",
    "nav.people": "人物",
    "nav.events": "予定",
    "nav.network": "関係図",
    "nav.settings": "設定",
    "action.save": "保存",
    "action.cancel": "キャンセル",
    "action.search": "検索",
    "action.snooze": "Snooze",
    "status.local_workspace": "ローカルワークスペース",
    "review.why.open_commitment": "Open commitment with {person_name}",
    "review.why.birthday": "Birthday in {day_count} days",
    "review.no_strength_score": "Liaison does not calculate relationship strength.",
    "profile.readiness.missing": "Missing for {purpose_name}: {field_list}",
    "error.workspace_not_found.title": "Workspace not found",
    "error.workspace_not_found.recovery": "Choose a Liaison workspace folder or create a new one."
  }
}
